{"artifact_hashes":{"canonical_step":"5966396bba993c5aaff23d5ebfccacb3ad0cf359fed38e93c721dfeac85e4e0a","native_history":"9b9e97d7eaff549c374e157ea181f855eb4ee9a0482003859c9827fc3fa24f3e"},"bbox":{"diagonal":57.5753542,"xlen":18.476,"xmax":9.238,"xmin":-9.238,"ylen":16.0006854,"ymax":8.0003427,"ymin":-8.0003427,"zlen":52.13,"zmax":52.13,"zmin":0.0},"body_count":1,"center_of_mass_geometry_only":[0.0,-0.0,25.4337964],"constraint_relations":[],"edge_table":[{"entity_id":"edge_0e6131e646da","raw_occt_index":3,"signature":{"bbox":{"diagonal":9.238,"xlen":4.619,"xmax":9.238,"xmin":4.619,"ylen":8.0003427,"ymax":8.0003427,"ymin":0.0,"zlen":0.0,"zmax":0.0,"zmin":0.0},"center":[6.9285,4.0001713,0.0],"geometry_type":"LINE","length":9.238,"vertices":[[4.619,8.0003427,0.0],[9.238,0.0,0.0]]},"signature_hash":"0e6131e646daf131ab88930c0e921eb51d1fcfac0069907275e42606b14d415f"},{"entity_id":"edge_102d540b25d9","raw_occt_index":8,"signature":{"bbox":{"diagonal":48.27,"xlen":0.0,"xmax":-4.619,"xmin":-4.619,"ylen":0.0,"ymax":8.0003427,"ymin":8.0003427,"zlen":48.27,"zmax":48.27,"zmin":0.0},"center":[-4.619,8.0003427,24.135],"geometry_type":"LINE","length":48.27,"vertices":[[-4.619,8.0003427,0.0],[-4.619,8.0003427,48.27]]},"signature_hash":"102d540b25d945769c9dcb09921ed8db0950def2a63004beb97de3cd35980cd6"},{"entity_id":"edge_2162ce6279b3","raw_occt_index":15,"signature":{"bbox":{"diagonal":9.238,"xlen":4.619,"xmax":-4.619,"xmin":-9.238,"ylen":8.0003427,"ymax":0.0,"ymin":-8.0003427,"zlen":0.0,"zmax":48.27,"zmin":48.27},"center":[-6.9285,-4.0001713,48.27],"geometry_type":"LINE","length":9.238,"vertices":[[-9.238,0.0,48.27],[-4.619,-8.0003427,48.27]]},"signature_hash":"2162ce6279b3b7e27d0e24c43d49488bef995527e80a4d3895fe90eeea6d020a"},{"entity_id":"edge_2d67db0c3980","raw_occt_index":5,"signature":{"bbox":{"diagonal":9.238,"xlen":4.619,"xmax":9.238,"xmin":4.619,"ylen":8.0003427,"ymax":-0.0,"ymin":-8.0003427,"zlen":0.0,"zmax":48.27,"zmin":48.27},"center":[6.9285,-4.0001713,48.27],"geometry_type":"LINE","length":9.238,"vertices":[[4.619,-8.0003427,48.27],[9.238,0.0,48.27]]},"signature_hash":"2d67db0c3980cfe84b39c35d946e1ff71c6f9de4bc52b2663859b237f5d3cd41"},{"entity_id":"edge_3d2cd5f3efcf","raw_occt_index":23,"signature":{"bbox":{"diagonal":13.6471609,"xlen":9.65,"xmax":4.825,"xmin":-4.825,"ylen":9.65,"ymax":4.825,"ymin":-4.825,"zlen":0.0,"zmax":52.13,"zmin":52.13},"center":[0.0,0.0,52.13],"geometry_type":"CIRCLE","length":30.3163691,"radius":4.825,"vertices":[[4.825,0.0,52.13]]},"signature_hash":"3d2cd5f3efcf6d150bae7b700af687945dc78f07a6bf241982d92826494dd11c"},{"entity_id":"edge_422f6c051b36","raw_occt_index":14,"signature":{"bbox":{"diagonal":9.238,"xlen":4.619,"xmax":-4.619,"xmin":-9.238,"ylen":8.0003427,"ymax":8.0003427,"ymin":0.0,"zlen":0.0,"zmax":48.27,"zmin":48.27},"center":[-6.9285,4.0001713,48.27],"geometry_type":"LINE","length":9.238,"vertices":[[-9.238,0.0,48.27],[-4.619,8.0003427,48.27]]},"signature_hash":"422f6c051b36372014ddf8d70b6bbccd12666a5fe51684581d591d85b9b25dc8"},{"entity_id":"edge_4dc58793cdb0","raw_occt_index":11,"signature":{"bbox":{"diagonal":9.238,"xlen":4.619,"xmax":-4.619,"xmin":-9.238,"ylen":8.0003427,"ymax":0.0,"ymin":-8.0003427,"zlen":0.0,"zmax":0.0,"zmin":0.0},"center":[-6.9285,-4.0001713,0.0],"geometry_type":"LINE","length":9.238,"vertices":[[-9.238,0.0,0.0],[-4.619,-8.0003427,0.0]]},"signature_hash":"4dc58793cdb008c632dd0b076dba499186f61b4f325ee61483c4cd8d27903e11"},{"entity_id":"edge_63526265003b","raw_occt_index":6,"signature":{"bbox":{"diagonal":9.238,"xlen":4.619,"xmax":9.238,"xmin":4.619,"ylen":8.0003427,"ymax":-0.0,"ymin":-8.0003427,"zlen":0.0,"zmax":0.0,"zmin":0.0},"center":[6.9285,-4.0001713,0.0],"geometry_type":"LINE","length":9.238,"vertices":[[4.619,-8.0003427,0.0],[9.238,0.0,0.0]]},"signature_hash":"63526265003ba3c4d0f86d9276a08836b1a5a1cd564367e0a5222607311c9a79"},{"entity_id":"edge_6f87a182399f","raw_occt_index":12,"signature":{"bbox":{"diagonal":9.238,"xlen":9.238,"xmax":4.619,"xmin":-4.619,"ylen":0.0,"ymax":-8.0003427,"ymin":-8.0003427,"zlen":0.0,"zmax":0.0,"zmin":0.0},"center":[0.0,-8.0003427,0.0],"geometry_type":"LINE","length":9.238,"vertices":[[-4.619,-8.0003427,0.0],[4.619,-8.0003427,0.0]]},"signature_hash":"6f87a182399f7d70730750df4538f79ca5c4d33729aad38a23abd3de9cedcbf2"},{"entity_id":"edge_7436a014ae91","raw_occt_index":18,"signature":{"bbox":{"diagonal":48.27,"xlen":0.0,"xmax":-4.619,"xmin":-4.619,"ylen":0.0,"ymax":-8.0003427,"ymin":-8.0003427,"zlen":48.27,"zmax":48.27,"zmin":0.0},"center":[-4.619,-8.0003427,24.135],"geometry_type":"LINE","length":48.27,"vertices":[[-4.619,-8.0003427,0.0],[-4.619,-8.0003427,48.27]]},"signature_hash":"7436a014ae915881f7cbfa4b5bff2f5ccc24aeebe203f75370f38c9134c9a5af"},{"entity_id":"edge_746cc3b45bab","raw_occt_index":21,"signature":{"bbox":{"diagonal":5.79,"xlen":0.0,"xmax":-4.105,"xmin":-4.105,"ylen":0.0,"ymax":0.0,"ymin":0.0,"zlen":5.79,"zmax":5.79,"zmin":0.0},"center":[-4.105,0.0,2.895],"geometry_type":"LINE","length":5.79,"vertices":[[-4.105,0.0,0.0],[-4.105,0.0,5.79]]},"signature_hash":"746cc3b45bab34761d56659cfbfbffc0ba1c1d24edddca810cf75295a76222e5"},{"entity_id":"edge_894bdb8eb8a0","raw_occt_index":0,"signature":{"bbox":{"diagonal":48.27,"xlen":0.0,"xmax":9.238,"xmin":9.238,"ylen":0.0,"ymax":0.0,"ymin":0.0,"zlen":48.27,"zmax":48.27,"zmin":0.0},"center":[9.238,0.0,24.135],"geometry_type":"LINE","length":48.27,"vertices":[[9.238,0.0,0.0],[9.238,0.0,48.27]]},"signature_hash":"894bdb8eb8a0a35c5968d83defddb40c95856eca69e5e18a2c2bedd4deacd135"},{"entity_id":"edge_94220efd7222","raw_occt_index":2,"signature":{"bbox":{"diagonal":48.27,"xlen":0.0,"xmax":4.619,"xmin":4.619,"ylen":0.0,"ymax":8.0003427,"ymin":8.0003427,"zlen":48.27,"zmax":48.27,"zmin":0.0},"center":[4.619,8.0003427,24.135],"geometry_type":"LINE","length":48.27,"vertices":[[4.619,8.0003427,0.0],[4.619,8.0003427,48.27]]},"signature_hash":"94220efd7222600fba5dc7345d3619ac2c4323c1658cdab0c54d8e1570d90506"},{"entity_id":"edge_a0212cd39856","raw_occt_index":17,"signature":{"bbox":{"diagonal":13.6471609,"xlen":9.65,"xmax":4.825,"xmin":-4.825,"ylen":9.65,"ymax":4.825,"ymin":-4.825,"zlen":0.0,"zmax":48.27,"zmin":48.27},"center":[0.0,0.0,48.27],"geometry_type":"CIRCLE","length":30.3163691,"radius":4.825,"vertices":[[4.825,0.0,48.27]]},"signature_hash":"a0212cd398563a33a5b499c783b0a981393bf6702ee46d62b89d34682b67113a"},{"entity_id":"edge_bae154573635","raw_occt_index":4,"signature":{"bbox":{"diagonal":48.27,"xlen":0.0,"xmax":4.619,"xmin":4.619,"ylen":0.0,"ymax":-8.0003427,"ymin":-8.0003427,"zlen":48.27,"zmax":48.27,"zmin":0.0},"center":[4.619,-8.0003427,24.135],"geometry_type":"LINE","length":48.27,"vertices":[[4.619,-8.0003427,0.0],[4.619,-8.0003427,48.27]]},"signature_hash":"bae1545736351e3844a2927059ecffbb414f7c0b37295d1df1b6f059d9e1dc89"},{"entity_id":"edge_bc6cba4265ed","raw_occt_index":9,"signature":{"bbox":{"diagonal":9.238,"xlen":9.238,"xmax":4.619,"xmin":-4.619,"ylen":0.0,"ymax":8.0003427,"ymin":8.0003427,"zlen":0.0,"zmax":0.0,"zmin":0.0},"center":[0.0,8.0003427,0.0],"geometry_type":"LINE","length":9.238,"vertices":[[-4.619,8.0003427,0.0],[4.619,8.0003427,0.0]]},"signature_hash":"bc6cba4265ed2a7efb1acde2885461f49866894086768cbcc9c13702c27263eb"},{"entity_id":"edge_be762952b595","raw_occt_index":1,"signature":{"bbox":{"diagonal":9.238,"xlen":4.619,"xmax":9.238,"xmin":4.619,"ylen":8.0003427,"ymax":8.0003427,"ymin":0.0,"zlen":0.0,"zmax":48.27,"zmin":48.27},"center":[6.9285,4.0001713,48.27],"geometry_type":"LINE","length":9.238,"vertices":[[4.619,8.0003427,48.27],[9.238,0.0,48.27]]},"signature_hash":"be762952b59512cbee59a1e735a006ca9c305beedca71dd7d50c6a733db3b7e8"},{"entity_id":"edge_c1ee633df1e8","raw_occt_index":10,"signature":{"bbox":{"diagonal":9.238,"xlen":4.619,"xmax":-4.619,"xmin":-9.238,"ylen":8.0003427,"ymax":8.0003427,"ymin":0.0,"zlen":0.0,"zmax":0.0,"zmin":0.0},"center":[-6.9285,4.0001713,0.0],"geometry_type":"LINE","length":9.238,"vertices":[[-9.238,0.0,0.0],[-4.619,8.0003427,0.0]]},"signature_hash":"c1ee633df1e807f08953d9ca1a110a886b4dd952475d4bbba601800340b0baa3"},{"entity_id":"edge_d1893c0c2e25","raw_occt_index":13,"signature":{"bbox":{"diagonal":11.6106933,"xlen":8.21,"xmax":4.105,"xmin":-4.105,"ylen":8.21,"ymax":4.105,"ymin":-4.105,"zlen":0.0,"zmax":0.0,"zmin":0.0},"center":[-0.0,-0.0,0.0],"geometry_type":"CIRCLE","length":25.7924757,"radius":4.105,"vertices":[[-4.105,0.0,0.0]]},"signature_hash":"d1893c0c2e25211b3b2eda930826c09d41028800b72404f85964b6c65af0e082"},{"entity_id":"edge_e7a3f4e761b7","raw_occt_index":16,"signature":{"bbox":{"diagonal":9.238,"xlen":9.238,"xmax":4.619,"xmin":-4.619,"ylen":0.0,"ymax":-8.0003427,"ymin":-8.0003427,"zlen":0.0,"zmax":48.27,"zmin":48.27},"center":[0.0,-8.0003427,48.27],"geometry_type":"LINE","length":9.238,"vertices":[[-4.619,-8.0003427,48.27],[4.619,-8.0003427,48.27]]},"signature_hash":"e7a3f4e761b752a5fabefa87ef979d6317583828c25693c6c45635d47a4f5a5b"},{"entity_id":"edge_eacfc2fb13c2","raw_occt_index":19,"signature":{"bbox":{"diagonal":48.27,"xlen":0.0,"xmax":-9.238,"xmin":-9.238,"ylen":0.0,"ymax":0.0,"ymin":0.0,"zlen":48.27,"zmax":48.27,"zmin":0.0},"center":[-9.238,0.0,24.135],"geometry_type":"LINE","length":48.27,"vertices":[[-9.238,0.0,0.0],[-9.238,0.0,48.27]]},"signature_hash":"eacfc2fb13c2b79f91698f08a8187ad3b9ff604e572afc83bcd0a8f0e2213cb0"},{"entity_id":"edge_efb570368c90","raw_occt_index":7,"signature":{"bbox":{"diagonal":9.238,"xlen":9.238,"xmax":4.619,"xmin":-4.619,"ylen":0.0,"ymax":8.0003427,"ymin":8.0003427,"zlen":0.0,"zmax":48.27,"zmin":48.27},"center":[0.0,8.0003427,48.27],"geometry_type":"LINE","length":9.238,"vertices":[[-4.619,8.0003427,48.27],[4.619,8.0003427,48.27]]},"signature_hash":"efb570368c90f430e645bde81ac403e219a6b513c393e35b56fb738dc62861a7"},{"entity_id":"edge_f236cbcca1b6","raw_occt_index":22,"signature":{"bbox":{"diagonal":3.86,"xlen":0.0,"xmax":4.825,"xmin":4.825,"ylen":0.0,"ymax":0.0,"ymin":0.0,"zlen":3.86,"zmax":52.13,"zmin":48.27},"center":[4.825,0.0,50.2],"geometry_type":"LINE","length":3.86,"verti